{
  "schema_version": "acquisition-bundle/2",
  "job_id": "job_0002_tdm_licensed",
  "request_id": "wr_tdm-licensed-2026",
  "identity": {
    "title": "Text and Data Mining Under Licence",
    "authors": [
      "Author, A."
    ]
  },
  "candidate": {
    "source": "crossref_tdm",
    "version": "published",
    "access_basis": "licensed_api",
    "reuse_license": "unknown",
    "entitlement": {
      "route": "https://api.crossref.org",
      "entitlement_ref": "entitlement:source:crossref_tdm",
      "acquisition_mode": "daemon_held_credential"
    }
  },
  "retrieved_at": "2026-07-31T10:00:00Z",
  "artifact": {
    "sha256": "bbbbbbbbbbbbbbbbbbbbbbbbbbbbbbbbbbbbbbbbbbbbbbbbbbbbbbbbbbbbbbbb",
    "size_bytes": 204800,
    "mime": "application/pdf",
    "page_count": 18,
    "ocr_used": false,
    "path": "artifacts/bbbbbbbbbbbbbbbbbbbbbbbbbbbbbbbbbbbbbbbbbbbbbbbbbbbbbbbbbbbbbbbb.pdf"
  },
  "validation": {
    "structural": "pass",
    "identity": "pass"
  },
  "provenance_digest": "sha256:bbbbbbbbbbbbbbbbbbbbbbbbbbbbbbbbbbbbbbbbbbbbbbbbbbbbbbbbbbbbbbbb"
}
